Rank,EntryId,EntryName,TimeRemaining,Points,Lineup,,Player,Roster Position,%Drafted,FPTS
1,2381381557,Tmtmtm,0,176.48,DST Falcons  QB Kirk Cousins FLEX A.J. Green TE Kyle Rudolph RB Derrick Henry RB Dalvin Cook WR Darius Slayton WR A.J. Brown WR Justin Jefferson,,Dalvin Cook,RB,42.00%,11.2
2,2381255317,DWossPoss21,0,175.87999,DST Bills  WR DeVante Parker WR Breshad Perriman RB Derrick Henry TE Evan Engram RB Nick Chubb QB Josh Allen WR Jakobi Meyers FLEX Tee Higgins,,Darren Waller,TE,30.00%,6.3
3,2381778633,dmill01,0,171.98,DST Dolphins  QB Ryan Fitzpatrick WR Jarvis Landry WR DeVante Parker FLEX Damiere Byrd RB Mike Davis RB Derrick Henry TE Evan Engram WR Christian Kirk,,Nyheim Hines,RB,27.00%,17.5
4,2382252481,gregdaniels,0,169.68001,DST Dolphins  FLEX Trey Burton WR Robby Anderson RB Mike Davis RB Derrick Henry TE Evan Engram QB Josh Allen WR Jalen Guyton WR Justin Jefferson,,Giants ,DST,26.50%,9
5,2382280909,jthom41,0,163.54,DST Giants  FLEX Nelson Agholor TE Evan Engram WR Curtis Samuel RB Nick Chubb RB Nyheim Hines WR Calvin Ridley QB Justin Herbert WR Justin Jefferson,,Stefon Diggs,WR,24.50%,10.9
6,2381988092,mythicalrhymer01,0,163.04,DST Giants  QB Ryan Tannehill TE Darren Waller WR Robby Anderson WR Corey Davis RB Nyheim Hines RB James Robinson FLEX A.J. Brown WR Justin Jefferson,,Justin Jefferson,WR,23.50%,26
7,2382030817,chino68,0,162.79999,DST Browns  QB Derek Carr WR Jarvis Landry WR DeVante Parker RB Mike Davis TE Evan Engram WR Curtis Samuel FLEX Nick Chubb RB James Robinson,,DeVante Parker,WR,21.50%,22.9
8,2381747617,Mastiffs,0,161.87999,DST Dolphins  QB Kirk Cousins WR Cole Beasley WR Jarvis Landry TE Hunter Henry RB Austin Ekeler WR Christian Kirk RB Damien Harris FLEX James Robinson,,Kareem Hunt,RB,21.00%,6.2
9,2381608832,dc_grounded,0,155.98,DST Giants  WR Cole Beasley WR Damiere Byrd WR Robby Anderson RB Derrick Henry TE Hunter Henry RB Austin Ekeler QB Josh Allen FLEX Tee Higgins,,Nick Chubb,RB,20.00%,29.6
10,2381880658,ajg616Dallas,0,155.68001,DST Titans  QB Ryan Fitzpatrick TE Trey Burton WR Jarvis Landry WR DeVante Parker FLEX Robby Anderson WR Stefon Diggs RB Dalvin Cook RB Nyheim Hines,,Calvin Ridley,WR,20.00%,17
11,2381765880,jab297,0,154.2,DST Vikings  QB Matt Ryan WR Cole Beasley WR DeVante Parker RB Mike Davis FLEX Kenyan Drake RB Nick Chubb TE Mike Gesicki WR A.J. Brown,,Josh Allen,QB,19.50%,17.48
12,2381435105,Macquesta,0,152.98,DST Jets  QB Kirk Cousins FLEX Kyle Rudolph WR Nelson Agholor WR Stefon Diggs RB Derrick Henry RB Dalvin Cook TE David Njoku WR Justin Jefferson,,Keenan Allen,WR,18.50%,16
13,2381879812,jagnole2013,0,150.57999,DST Titans  TE Trey Burton WR Jarvis Landry WR DeVante Parker RB Kareem Hunt RB Dalvin Cook QB Josh Allen FLEX James Robinson WR Henry Ruggs III,,Josh Jacobs,FLEX,18.00%,6.4
14,2381662473,oneill0410,0,148.87999,DST Falcons  QB Ryan Fitzpatrick WR DeAndre Hopkins WR DeVante Parker TE Hunter Henry RB Kareem Hunt RB Brian Hill WR Calvin Ridley FLEX A.J. Brown,,DeAndre Hopkins,WR,18.00%,10.5
15,2381323195,christiekd,0,147.98001,DST Giants  QB Ryan Fitzpatrick TE Kyle Rudolph WR Keenan Allen WR DeAndre Hopkins WR DeVante Parker FLEX Derrick Henry RB Jordan Wilkins RB Matt Breida,,Derek Carr,QB,18.00%,4.6
16,2381174410,jack5095,0,147.79999,DST Vikings  QB Matt Ryan WR Jarvis Landry WR DeVante Parker FLEX Todd Gurley II RB Derrick Henry RB Kareem Hunt WR Justin Jefferson TE Mark Andrews,,Browns ,DST,17.50%,0
17,2381271738,Jgrand36,0,147.57999,DST Bills  WR DeAndre Hopkins FLEX Jarvis Landry WR Jamison Crowder RB Kenyan Drake TE Austin Hooper WR Curtis Samuel QB Josh Allen RB James Robinson,,Curtis Samuel,WR,17.00%,12.7
18,2382278197,Billsfanforlife,0,146.48,DST Titans  WR Golden Tate QB Kirk Cousins FLEX DeAndre Hopkins TE Darren Waller WR Damiere Byrd RB Derrick Henry RB Austin Ekeler WR Jakobi Meyers,,Wayne Gallman Jr.,RB,16.50%,18.1
19,2381614679,Dgooods,0,146.28,DST Giants  TE Darren Waller RB Kareem Hunt QB Josh Allen RB Nyheim Hines WR Calvin Ridley FLEX James Robinson WR Gabriel Davis WR Justin Jefferson,,Brian Hill,RB,15.50%,5.5
20,2381787219,Rmarchbank23,0,145,DST Falcons  QB Matt Ryan WR Julio Jones TE Tyler Eifert WR Jarvis Landry FLEX Sterling Shepard WR Stefon Diggs RB Kenyan Drake RB Dalvin Cook,,Nelson Agholor,WR,15.00%,10.4
21,2382032793,JJSLOKE,0,143.29999,DST Vikings  QB Derek Carr WR Jarvis Landry WR DeVante Parker FLEX Mike Williams TE Evan Engram RB Nick Chubb WR Calvin Ridley RB Josh Jacobs,,Cole Beasley,WR,14.50%,9.3
22,2381879525,zryan4,0,143.09999,DST Bills  QB Derek Carr TE Trey Burton WR DeVante Parker WR Breshad Perriman WR Sterling Shepard RB Nick Chubb RB Dalvin Cook FLEX James Robinson,,Derrick Henry,RB,14.50%,41.5
23,2382319578,cb.90,0,142.98,DST Giants  RB James White QB Teddy Bridgewater TE Darren Waller WR Robby Anderson WR Curtis Samuel WR DJ Moore RB James Robinson FLEX Justin Jefferson,,James Robinson,FLEX,14.00%,29.9
24,2381603840,candyman76574,0,142.88,DST Colts  QB Kirk Cousins FLEX Breshad Perriman WR Stefon Diggs RB Kenyan Drake TE Evan Engram WR Calvin Ridley RB Damien Harris WR Justin Jefferson,,Evan Engram,TE,13.00%,20.9
25,2382191025,Slimgoody73,0,141.9,DST Giants  QB Derek Carr TE Darren Waller WR Nelson Agholor FLEX Matt Breida RB Austin Ekeler RB Nick Chubb WR A.J. Brown WR Justin Jefferson,,Ryan Fitzpatrick,QB,12.50%,19.28
26,2381983220,mandulabigdummy,0,141.1,DST Jets  FLEX Cole Beasley QB Derek Carr TE Tyler Eifert WR Keenan Allen WR Nelson Agholor RB Derrick Henry RB Nick Chubb WR DJ Moore,,DJ Moore,WR,12.50%,10.1
27,2382197197,Richgalusha62,0,140.8,DST Bills  QB Derek Carr RB Derrick Henry TE Mike Gesicki WR Jakobi Meyers FLEX Hayden Hurst RB Josh Jacobs WR A.J. Brown WR Justin Jefferson,,Hunter Henry,TE,12.50%,13.7
28,2381552195,JC917,0,139.98001,DST Giants  QB Kirk Cousins WR Jamison Crowder RB Kenyan Drake TE Evan Engram FLEX Keelan Cole Sr. RB Dalvin Cook WR Christian Kirk WR Justin Jefferson,,Keelan Cole Sr.,FLEX,12.50%,7.4
29,2382096021,jbvikes,0,139.28,DST Browns  QB Ryan Fitzpatrick WR DeVante Parker FLEX Mo Alie-Cox TE Hunter Henry WR Curtis Samuel RB Nick Chubb RB Dalvin Cook WR Justin Jefferson,,Dolphins ,DST,12.50%,14
30,2382088785,UncleDutchy,0,139.2,DST Bills  WR Cole Beasley QB Derek Carr TE Darren Waller RB Kenyan Drake FLEX Derrick Henry WR Curtis Samuel RB Nyheim Hines WR Calvin Ridley,,Kyle Rudolph,TE,12.00%,13.8
31,2381852725,biggbankroll,0,139.04001,DST Jaguars  FLEX Mike Davis RB Wayne Gallman Jr. TE Jonnu Smith WR Curtis Samuel WR Calvin Ridley QB Justin Herbert RB James Robinson WR Justin Jefferson,,Justin Herbert,QB,12.00%,20.44
32,2381893757,piracy1068,0,138.48,DST Jaguars  QB Ryan Fitzpatrick WR Jarvis Landry TE Jonnu Smith FLEX Evan Engram RB Dalvin Cook WR Christian Kirk WR Calvin Ridley RB James Robinson,,Kyler Murray,QB,12.00%,8.9
33,2382382740,ndesmarais15,0,137.18,DST Bengals  WR Cole Beasley TE Kyle Rudolph FLEX Keenan Allen RB Dalvin Cook QB Josh Allen RB Nyheim Hines WR Gabriel Davis WR Justin Jefferson,,Robby Anderson,WR,11.00%,19.4
34,2381113391,bigtony747,0,136.82,DST Colts  WR DeAndre Hopkins WR Jarvis Landry RB Mike Davis RB Derrick Henry TE Evan Engram FLEX Hunter Renfrow QB Daniel Jones WR Darius Slayton,,Michael Pittman Jr.,WR,10.00%,4.8
35,2382220612,MarcLintermann,0,135.08,DST Giants  QB Ryan Fitzpatrick WR DeVante Parker RB Derrick Henry WR Russell Gage RB Dalvin Cook WR Denzel Mims FLEX Josh Jacobs TE Adam Shaheen,,Jonnu Smith,TE,9.50%,0
36,2381115634,MVP_of_fantasy,0,134.78,DST Browns  QB Ryan Fitzpatrick TE Kyle Rudolph WR DeVante Parker WR Nelson Agholor RB Nick Chubb RB Dalvin Cook WR DJ Moore FLEX Nyheim Hines,,Mike Davis,RB,9.50%,10.9
37,2382268769,LuckyLindy1994,0,134.48,DST Vikings  QB Kirk Cousins TE Darren Waller WR Robby Anderson RB Nick Chubb FLEX Tyler Conklin WR DJ Moore RB Josh Jacobs WR Justin Jefferson,,Colts ,DST,9.00%,-3
38,2381972656,SPEEDCULT,0,134.07999,DST Giants  QB Ryan Fitzpatrick WR DeVante Parker RB Wayne Gallman Jr. TE Evan Engram FLEX Brian Hill RB Dalvin Cook WR Jakobi Meyers WR Calvin Ridley,,Austin Ekeler,RB,9.00%,23.9
39,2381260762,swanniebaby,0,133.04001,DST Giants  FLEX Darren Waller WR DeVante Parker TE Jonnu Smith RB Jordan Wilkins RB Nick Chubb WR DJ Moore QB Justin Herbert WR Justin Jefferson,,Jamison Crowder,WR,8.00%,6.1
40,2381290330,damacklion,0,132.87999,DST Browns  WR Cole Beasley TE Tyler Eifert WR Jarvis Landry WR Mike Williams FLEX Dalvin Cook QB Josh Allen RB Nyheim Hines RB James Robinson,,Jakobi Meyers,WR,8.00%,10.2
41,2382024106,rryba34,0,132.38,DST Bills  WR Cole Beasley TE Tyler Kroft WR Stefon Diggs RB Kenyan Drake RB Nick Chubb QB Josh Allen FLEX Zack Moss WR Justin Jefferson,,Sterling Shepard,WR,8.00%,13.8
42,2381384070,bigal6692,0,132.24,DST Colts  QB Ryan Tannehill FLEX Jamison Crowder TE Darren Waller WR Robby Anderson WR Tyler Boyd RB Austin Ekeler RB James Robinson WR Justin Jefferson,,Kenyan Drake,RB,8.00%,24.3
43,2381930098,fluidone,0,131.77998,DST Dolphins  QB Ryan Fitzpatrick TE Darren Waller WR DeVante Parker WR Nelson Agholor RB Kareem Hunt WR Curtis Samuel FLEX DJ Moore RB James Robinson,,Christian Kirk,FLEX,8.00%,4.9
44,2381351486,stanmans9,0,131.58,DST Giants  WR T.Y. Hilton TE Darren Waller RB Wayne Gallman Jr. RB Dalvin Cook QB Josh Allen FLEX Nyheim Hines WR Calvin Ridley WR Gabriel Davis,,Damiere Byrd,WR,7.50%,6.3
45,2381612533,ElectricAve,0,131.5,DST Vikings  QB Matt Ryan WR DeVante Parker RB Brian Hill RB Dalvin Cook TE Mike Gesicki FLEX Nyheim Hines WR Calvin Ridley WR Justin Jefferson,,Tyler Boyd,FLEX,7.00%,4.5
46,2381895669,Big_Cox,0,131.38,DST Colts  QB Ryan Fitzpatrick WR DeVante Parker WR Stefon Diggs TE Evan Engram FLEX Nick Chubb RB Brian Hill RB Chase Edmonds WR Calvin Ridley,,Mike Gesicki,FLEX,7.00%,11.5
47,2381136664,jsmit197,0,131.14,DST Giants  QB Ryan Tannehill TE Trey Burton WR DeAndre Hopkins WR Jamison Crowder WR Robby Anderson RB Nyheim Hines FLEX James Robinson RB Josh Jacobs,,Jarvis Landry,WR,6.50%,31.3
48,2381680974,Darth_Dracuul,0,131.04001,DST Dolphins  TE Kyle Rudolph WR Keenan Allen WR Stefon Diggs RB Wayne Gallman Jr. RB Matt Breida FLEX Brian Hill QB Justin Herbert WR Justin Jefferson,,Trey Burton,TE,6.50%,13.2
49,2381794020,bsm80,0,130.38,DST Browns  QB Ryan Fitzpatrick WR DeVante Parker TE Hunter Henry WR KhaDarel Hodge FLEX Nick Chubb RB Dalvin Cook WR DJ Moore RB Nyheim Hines,,Mike Williams,WR,5.50%,5.6
50,2382142687,squibbed,0,129.68,DST Dolphins  FLEX Keenan Allen WR DeVante Parker RB Derrick Henry WR Mike Williams TE Jonnu Smith RB Brian Hill QB Josh Allen WR Laviska Shenault Jr.,,Jets ,DST,5.50%,9
51,2381999223,bac544385,0,129.12,DST Giants  WR Cole Beasley RB Derrick Henry TE Evan Engram FLEX Keelan Cole Sr. WR Curtis Samuel RB Dalvin Cook QB Daniel Jones WR Laviska Shenault Jr.,,A.J. Brown,WR,5.50%,25.8
52,2381774568,CSM3,0,128.3,DST Bills  RB Frank Gore WR Cole Beasley TE Kyle Rudolph WR Stefon Diggs RB Derrick Henry FLEX Austin Hooper QB Kyler Murray WR Calvin Ridley,,Daniel Jones,QB,5.00%,10.42
53,2382049679,rubygirl01,0,127.94,DST Colts  TE Darren Waller WR Breshad Perriman WR Corey Davis FLEX Curtis Samuel RB Nick Chubb WR DJ Moore QB Justin Herbert RB James Robinson,,Laviska Shenault Jr.,WR,5.00%,6.7
54,2381234317,illboyz24,0,127.78,DST Jets  TE Kyle Rudolph WR Stefon Diggs RB Brian Hill RB Dalvin Cook QB Josh Allen FLEX Calvin Ridley WR Gabriel Davis WR Justin Jefferson,,Austin Hooper,TE,5.00%,9.3
55,2381707448,Millennium_Falcons,0,127.6,DST Giants  WR Damiere Byrd WR Stefon Diggs RB Derrick Henry FLEX Jonnu Smith TE Hunter Henry WR Keelan Cole Sr. QB Kyler Murray RB James Robinson,,Vikings ,DST,5.00%,5
56,2381526901,Bwood310,0,126.78,DST Giants  QB Ryan Fitzpatrick RB Wayne Gallman Jr. WR Curtis Samuel RB Dalvin Cook TE Mike Gesicki WR Christian Kirk WR Jakobi Meyers FLEX James Robinson,,Bills ,DST,5.00%,6
57,2381697247,exyhome,0,126.5,DST Browns  QB Derek Carr TE Darren Waller WR Nelson Agholor WR Stefon Diggs RB Derrick Henry FLEX Austin Hooper RB Nyheim Hines WR Justin Jefferson,,Corey Davis,WR,4.50%,10
58,2381396048,NCity84,0,125.700005,DST Dolphins  WR DeVante Parker RB Austin Ekeler RB Nick Chubb TE Mike Gesicki WR DJ Moore QB Kyler Murray FLEX Michael Pittman Jr. WR Donovan Peoples-Jones,,Damien Harris,RB,4.50%,4.7
59,2381176768,texasearl,0,125.1,DST Bengals  WR Keenan Allen WR DeVante Parker TE Austin Hooper RB Austin Ekeler WR Curtis Samuel FLEX Christian Kirk QB Kyler Murray RB Nyheim Hines,,Matt Breida,RB,4.50%,6.3
60,2382261534,joeytoes,0,124.799995,DST Jets  QB Derek Carr WR Keenan Allen WR DeVante Parker TE Evan Engram FLEX Jordan Wilkins RB Brian Hill RB Dalvin Cook WR Justin Jefferson,,Jordan Wilkins,RB,4.00%,8.7
61,2381713361,Robd37,0,124.64001,DST Giants  WR Keenan Allen FLEX Mike Davis TE Hunter Henry RB Matt Breida RB Nyheim Hines QB Justin Herbert WR Michael Pittman Jr. WR Justin Jefferson,,Tee Higgins,WR,4.00%,15.4
62,2382060196,shanegord,0,124.619995,DST Browns  WR Damiere Byrd WR Sterling Shepard TE Evan Engram FLEX Russell Gage RB Nick Chubb RB Dalvin Cook QB Daniel Jones WR Justin Jefferson,,Teddy Bridgewater,QB,4.00%,14.88
63,2381783598,DieselDon28,0,124.6,DST Chargers  QB Derek Carr TE Darren Waller WR Nelson Agholor RB Austin Ekeler WR Curtis Samuel RB Nick Chubb WR Olamide Zaccheaus FLEX Justin Jefferson,,Hunter Renfrow,FLEX,3.50%,14.3
64,2382369582,thedude01,0,124.2,DST Titans  WR A.J. Green WR Cole Beasley TE Trey Burton FLEX Robby Anderson RB Derrick Henry RB Dalvin Cook QB Kyler Murray WR Denzel Mims,,Darius Slayton,WR,3.50%,0
65,2382344229,frenchy2m,0,123.9,DST Dolphins  FLEX DeVante Parker WR Nelson Agholor TE Evan Engram WR Curtis Samuel QB Kyler Murray RB Nyheim Hines WR Jakobi Meyers RB Josh Jacobs,,Denzel Mims,FLEX,3.50%,10.7
66,2382283755,telgar42,0,123.68,DST Dolphins  WR Stefon Diggs RB Derrick Henry WR Tyler Boyd TE Hunter Henry RB Kareem Hunt FLEX Anthony Firkser QB Josh Allen WR Tee Higgins,,Gabriel Davis,WR,3.50%,16.9
67,2381618033,tcross20,0,123.28,DST Colts  QB Ryan Fitzpatrick RB James White WR Keenan Allen WR DeVante Parker RB Nick Chubb FLEX Christian Kirk WR DJ Moore TE Hayden Hurst,,Matt Ryan,QB,3.50%,14.9
68,2381650347,NeefBuck88,0,123.2,DST Bills  TE Trey Burton FLEX Jamison Crowder WR Nelson Agholor RB Derrick Henry RB Kareem Hunt WR Christian Kirk QB Kyler Murray WR Justin Jefferson,,Jaguars ,DST,3.50%,4
69,2381127356,Starfire2005,0,123,DST Colts  WR Golden Tate FLEX DeAndre Hopkins WR Nelson Agholor WR Sterling Shepard RB Kenyan Drake TE Evan Engram RB Nick Chubb QB Kyler Murray,,Breshad Perriman,WR,3.50%,11.9
70,2381073922,mizop1,0,122.880005,DST Cardinals  QB Ryan Fitzpatrick TE Darren Waller WR Nelson Agholor WR Stefon Diggs RB Wayne Gallman Jr. RB Nyheim Hines FLEX Josh Jacobs WR Justin Jefferson,,Kirk Cousins,QB,3.50%,30.18
71,2381979679,jacktrimble,0,122.700005,DST Giants  QB Matt Ryan WR Keenan Allen WR DeVante Parker FLEX Stefon Diggs TE Jonnu Smith RB Brian Hill RB Nyheim Hines WR Justin Jefferson,,A.J. Green,FLEX,3.50%,0
72,2381636173,chucoley1,0,122.08,DST Dolphins  TE Kyle Rudolph WR DeAndre Hopkins WR DeVante Parker RB Mike Davis WR Corey Davis FLEX Hunter Henry QB Josh Allen RB Zack Moss,,Titans ,DST,3.50%,10
73,2381301952,Scotty321,0,121.479996,DST Colts  QB Teddy Bridgewater TE Darren Waller WR DeVante Parker WR Sterling Shepard RB Kenyan Drake RB Kareem Hunt WR DJ Moore FLEX Justin Jefferson,,Hayden Hurst,TE,3.50%,8.8
74,2381729752,tmoxx07,0,120.91999,DST Giants  WR DeVante Parker WR Sterling Shepard WR Stefon Diggs TE Hunter Henry RB Kareem Hunt RB Austin Ekeler FLEX DJ Moore QB Daniel Jones,,Cardinals ,DST,3.00%,8
75,2381770222,schager1,0,120.1,DST Jets  QB Matt Ryan TE Tyler Eifert RB Derrick Henry WR Keelan Cole Sr. RB Dalvin Cook WR Olamide Zaccheaus WR Calvin Ridley FLEX Josh Jacobs,,Raiders ,DST,3.00%,-1
76,2381120275,sdip60,0,119.8,DST Giants  QB Derek Carr WR DeAndre Hopkins WR DeVante Parker WR Stefon Diggs TE Austin Hooper FLEX Nick Chubb RB Brian Hill RB Nyheim Hines,,Anthony Firkser,TE,3.00%,0
77,2381687952,Drewdrew69me,0,119.78,DST Raiders  QB Ryan Fitzpatrick WR Cole Beasley TE Trey Burton WR Keenan Allen FLEX DeAndre Hopkins RB Wayne Gallman Jr. RB Nick Chubb WR Michael Pittman Jr.,,Tyler Eifert,TE,3.00%,10.6
78,2382033286,Kangel196,0,119.479996,DST Dolphins  WR A.J. Green TE Kyle Rudolph RB Dion Lewis WR DeAndre Hopkins FLEX Stefon Diggs RB Kenyan Drake QB Josh Allen WR A.J. Brown,,Olamide Zaccheaus,WR,3.00%,2.1
79,2382438661,expander,0,118.8,DST Giants  QB Derek Carr WR Keenan Allen TE Darren Waller WR Robby Anderson FLEX Breshad Perriman WR Tyler Boyd RB Nick Chubb RB Nyheim Hines,,Cam Newton,QB,2.50%,5.96
80,2381163781,brickaneers,0,117.78001,DST Browns  QB Ryan Fitzpatrick TE Kyle Rudolph WR Keenan Allen WR DeVante Parker FLEX Nelson Agholor WR Stefon Diggs RB Wayne Gallman Jr. RB Josh Jacobs,,James White,RB,2.50%,14.7
81,2382410573,jimmymac1305,0,117.600006,DST Dolphins  QB Derek Carr WR Nelson Agholor RB Kareem Hunt WR Curtis Samuel TE Mike Gesicki RB Josh Jacobs FLEX A.J. Brown WR Justin Jefferson,,Ryan Tannehill,QB,2.50%,19.14
82,2381214466,buldog12,0,117.41999,DST Bills  TE Trey Burton FLEX Darren Waller RB Derrick Henry WR Mike Williams WR Rashard Higgins QB Baker Mayfield WR Curtis Samuel RB Dalvin Cook,,Golden Tate,WR,2.50%,7.6
83,2381970675,Yeti918,0,116.9,DST Giants  QB Derek Carr TE Darren Waller WR Sterling Shepard FLEX Jordan Wilkins WR Keelan Cole Sr. RB Dalvin Cook RB James Robinson WR Justin Jefferson,,Bengals ,DST,2.50%,9
84,2382107186,DemDog70,0,116.49999,DST Jets  WR Keenan Allen TE Darren Waller WR Nelson Agholor RB Matt Breida WR KhaDarel Hodge RB Austin Ekeler FLEX Nick Chubb QB Kyler Murray,,Baker Mayfield,QB,2.50%,18.42
85,2382033327,osufan3872,0,116.479996,DST Vikings  QB Ryan Fitzpatrick WR Keenan Allen WR DeAndre Hopkins WR Stefon Diggs RB Wayne Gallman Jr. TE Hunter Henry RB Brian Hill FLEX Nyheim Hines,,Russell Gage,WR,2.50%,6.4
86,2381147033,left_unheard,0,116.380005,DST Giants  TE Jack Doyle WR Keenan Allen WR Stefon Diggs FLEX Brian Hill QB Josh Allen WR DJ Moore RB Nyheim Hines RB James Robinson,,Donovan Peoples-Jones,WR,2.00%,0
87,2382423383,weekssam,0,116.28,DST Browns  QB Ryan Fitzpatrick WR Robby Anderson WR Sterling Shepard FLEX Wayne Gallman Jr. TE Anthony Firkser RB Nick Chubb RB Dalvin Cook WR Christian Kirk,,Zack Moss,RB,2.00%,8.8
88,2382329939,paulooch,0,115.58,DST Dolphins  WR Cole Beasley WR T.Y. Hilton TE Darren Waller FLEX Curtis Samuel RB Dalvin Cook WR Hunter Renfrow QB Josh Allen RB Devin Singletary,,Giovani Bernard,RB,2.00%,6.9
89,2382332383,Awnaw,0,115.4,DST Giants  QB Derek Carr TE Darren Waller RB Kenyan Drake WR Corey Davis WR Keelan Cole Sr. WR Curtis Samuel FLEX Dalvin Cook RB James Robinson,,Falcons ,DST,1.50%,28
90,2381855001,jshalls01,0,115.18,DST Dolphins  WR Cole Beasley WR Jamison Crowder TE Hunter Henry RB Kareem Hunt FLEX Chase Edmonds QB Josh Allen WR Jakobi Meyers RB James Robinson,,Devin Singletary,RB,1.50%,12.2
91,2381686804,wared81,0,115.1,DST Dolphins  WR Damiere Byrd WR Breshad Perriman TE Jonnu Smith RB Dalvin Cook QB Kyler Murray RB Nyheim Hines FLEX James Robinson WR Tee Higgins,,Chase Edmonds,RB,1.50%,8.3
92,2382328660,jasen1972,0,114.619995,DST Browns  WR Jarvis Landry WR Jamison Crowder TE Austin Hooper WR Rashard Higgins RB Kareem Hunt QB Baker Mayfield RB Nick Chubb FLEX Dalvin Cook,,Tyler Kroft,TE,1.50%,0
93,2381115719,iamclaypetr,0,114.57999,DST Giants  QB Ryan Fitzpatrick WR Stefon Diggs RB Wayne Gallman Jr. TE Hunter Henry RB Jordan Wilkins FLEX Dalvin Cook WR Calvin Ridley WR Laviska Shenault Jr.,,KhaDarel Hodge,WR,1.50%,6.1
94,2381642060,FusterKluck,0,113.41999,DST Giants  WR DeVante Parker FLEX Wayne Gallman Jr. WR Tyler Boyd RB Kareem Hunt TE Evan Engram RB Dalvin Cook QB Daniel Jones WR Jakobi Meyers,,Henry Ruggs III,WR,1.50%,8.4
95,2381597802,bfurlow8,0,113.08,DST Giants  WR Stefon Diggs FLEX Brian Hill RB Dalvin Cook QB Josh Allen RB Nyheim Hines TE Hayden Hurst WR Laviska Shenault Jr. WR Justin Jefferson,,Jack Doyle,TE,1.00%,0
96,2382297792,jadspive,0,112.9,DST Giants  TE Kyle Rudolph QB Derek Carr WR Keelan Cole Sr. RB Dalvin Cook RB Nyheim Hines WR Calvin Ridley FLEX Josh Jacobs WR Justin Jefferson,,Rashard Higgins,WR,1.00%,2.5
97,2382373962,wadeb09,0,112.88,DST Browns  QB Teddy Bridgewater WR Robby Anderson RB Mike Davis WR Keelan Cole Sr. FLEX Nick Chubb RB Dalvin Cook TE Hayden Hurst WR Denzel Mims,,Jalen Guyton,WR,1.00%,6.3
98,2381934853,g1818g,0,112.78,DST Jets  WR Keenan Allen TE Tyler Kroft WR Robby Anderson WR Stefon Diggs RB Brian Hill QB Josh Allen RB Nyheim Hines FLEX Calvin Ridley,,T.Y. Hilton,WR,1.00%,18.1
98,2382255421,beemac22,0,112.77999,DST Giants  QB Ryan Fitzpatrick TE Tyler Eifert WR DeAndre Hopkins WR DeVante Parker WR Mike Williams FLEX Kareem Hunt RB Dalvin Cook RB Nyheim Hines,,Frank Gore,RB,1.00%,11.6
100,2381474107,BlackhawkGirl50,0,112.74,DST Browns  FLEX Kyle Rudolph WR DeVante Parker WR Stefon Diggs RB Wayne Gallman Jr. TE Jonnu Smith RB Dalvin Cook QB Justin Herbert WR Tee Higgins,,Julio Jones,WR,1.00%,0
101,2381545361,gohard5,0,112.45999,DST Giants  QB Cam Newton FLEX Kyle Rudolph WR Robby Anderson TE Hunter Henry RB Dalvin Cook WR Jakobi Meyers WR Calvin Ridley RB Devin Singletary,,Samaje Perine,RB,1.00%,1.2
102,2381722768,jmbrow936,0,112.04,DST Dolphins  WR Cole Beasley TE Tyler Eifert WR Nelson Agholor FLEX Kenyan Drake WR Mike Williams RB Kareem Hunt RB Dalvin Cook QB Justin Herbert,,Todd Gurley II,FLEX,0.50%,0
103,2381960613,Doogles724,0,111.4,DST Dolphins  FLEX Wayne Gallman Jr. WR Mike Williams WR Tyler Boyd TE Hunter Henry RB Nick Chubb QB Kyler Murray WR Michael Pittman Jr. RB Devin Singletary,,Mark Andrews,TE,0.50%,0
104,2381440293,bigsmith51,0,111.380005,DST Giants  WR Jamison Crowder TE Darren Waller WR Nelson Agholor FLEX Wayne Gallman Jr. RB Dalvin Cook QB Sam Darnold RB Nyheim Hines WR Justin Jefferson,,DeMichael Harris,WR,0.50%,1.3
105,2381497380,jkoish10,0,111.04,DST Giants  FLEX Jamison Crowder WR Robby Anderson WR Nelson Agholor RB Kareem Hunt TE Evan Engram WR Keelan Cole Sr. RB Dalvin Cook QB Justin Herbert,,K.J. Osborn,WR,0.50%,0
106,2381555268,Mr.Glitch,0,110.74001,DST Browns  WR Keenan Allen WR Sterling Shepard RB Wayne Gallman Jr. TE Hunter Henry RB Nyheim Hines QB Justin Herbert WR Michael Pittman Jr. FLEX Josh Jacobs,,David Njoku,TE,0.50%,0
107,2381774388,angelsand49ers,0,110.48,DST Jets  WR Keenan Allen TE Darren Waller FLEX Mike Davis WR Stefon Diggs RB Brian Hill QB Josh Allen RB Nyheim Hines WR Gabriel Davis,,Sam Darnold,QB,0.50%,6.78
108,2382131266,dannyvanzandt,0,110.38,DST Dolphins  WR Cole Beasley QB Teddy Bridgewater FLEX Darren Waller WR Robby Anderson RB Kareem Hunt RB Austin Ekeler TE Mike Gesicki WR Christian Kirk,,Jason Witten,TE,0.50%,0
109,2381997410,rilyoung5780,0,110.2,DST Giants  WR DeAndre Hopkins RB Wayne Gallman Jr. TE Evan Engram WR Keelan Cole Sr. RB Dalvin Cook QB Kyler Murray FLEX Nyheim Hines WR Laviska Shenault Jr.,,Marcus Mariota,QB,0.50%,0
110,2381783143,TySim,0,109.85999,DST Browns  QB Cam Newton TE Trey Burton WR Damiere Byrd RB Derrick Henry RB Nick Chubb FLEX Dalvin Cook WR Darius Slayton WR Olamide Zaccheaus,,Mason Schreck,FLEX,0.50%,0
111,2381302915,roederme,0,109.71999,DST Giants  WR DeAndre Hopkins WR Sterling Shepard TE Evan Engram RB Dalvin Cook FLEX DJ Moore QB Daniel Jones RB Nyheim Hines WR Jalen Guyton,,Joe Reed,WR,0.50%,0
112,2382391012,jonasjager,0,109.28,DST Titans  TE Darren Waller WR Mike Williams FLEX Kareem Hunt RB Austin Ekeler RB Nick Chubb QB Josh Allen WR Jakobi Meyers WR Darius Slayton,,Andre Roberts,FLEX,0.50%,0
113,2381443672,Mustang047,0,109.17999,DST Colts  TE Kyle Rudolph WR Keelan Cole Sr. RB Nick Chubb FLEX Brian Hill RB Dalvin Cook QB Josh Allen WR Jakobi Meyers WR Calvin Ridley,,Cameron Batson,WR,0.50%,0.5
114,2382353519,kcsjr,0,108.799995,DST Jets  WR DeAndre Hopkins TE Darren Waller WR DeVante Parker RB Wayne Gallman Jr. RB Jordan Wilkins FLEX Keelan Cole Sr. QB Kyler Murray WR Calvin Ridley,,Brandon Allen,QB,0.50%,8.14
115,2382310126,Bow2meNOW,0,108.58,DST Giants  WR Stefon Diggs RB Wayne Gallman Jr. FLEX Hunter Henry WR Curtis Samuel RB Dalvin Cook QB Josh Allen TE Hayden Hurst WR Laviska Shenault Jr.,,Drew Sample,TE,0.50%,7
116,2381572735,Daveanton9,0,108.48001,DST Giants  TE Darren Waller WR Stefon Diggs RB Wayne Gallman Jr. WR Keelan Cole Sr. QB Josh Allen RB Nyheim Hines FLEX Calvin Ridley WR Michael Pittman Jr.,,Auden Tate,FLEX,0.50%,0
117,2381899298,BKM1992,0,108.34,DST Dolphins  FLEX MyCole Pruitt WR Keenan Allen TE Hunter Henry RB Austin Ekeler RB Myles Gaskin WR DJ Moore WR Jakobi Meyers QB Justin Herbert,,Chargers ,DST,0.50%,9
118,2381771580,shadysbunch,0,108.17999,DST Browns  QB Teddy Bridgewater WR Nelson Agholor TE Mike Gesicki FLEX Nyheim Hines WR Calvin Ridley RB Damien Harris RB Josh Jacobs WR A.J. Brown,,Kalen Ballage,RB,0.50%,0
119,2382025769,tshoes3,0,107.88,DST Giants  WR Keenan Allen TE Darren Waller FLEX Wayne Gallman Jr. WR Keelan Cole Sr. RB Brian Hill RB Dalvin Cook QB Josh Allen WR Gabriel Davis,,MyCole Pruitt,FLEX,0.50%,0
120,2381997423,flavorxxx,0,107.80001,DST Cardinals  TE Darren Waller WR Robby Anderson RB Nick Chubb WR Christian Kirk QB Kyler Murray RB Nyheim Hines WR Michael Pittman Jr. FLEX Henry Ruggs III,,Myles Gaskin,RB,0.50%,0
120,2382006612,wiredin,0,107.799995,DST Bengals  WR DeAndre Hopkins WR Sterling Shepard TE Austin Hooper FLEX Austin Ekeler QB Kyler Murray RB Nyheim Hines WR Jakobi Meyers RB Damien Harris,,Patriots ,DST,0.50%,5
122,2382422696,venglord,0,107.52,DST Giants  TE Kyle Rudolph WR DeAndre Hopkins FLEX Wayne Gallman Jr. QB Baker Mayfield WR Keelan Cole Sr. WR Curtis Samuel RB Dalvin Cook RB Josh Jacobs,,Dion Lewis,RB,0.50%,2.7
122,2382458653,rickardred,0,107.52,DST Giants  TE Kyle Rudolph WR DeAndre Hopkins RB Wayne Gallman Jr. QB Baker Mayfield WR Keelan Cole Sr. WR Curtis Samuel FLEX Dalvin Cook RB Josh Jacobs,,Mo Alie-Cox,FLEX,0.50%,3.9
